{
  "schema_version": "ScanAttestationV1",
  "attestation_id": "scan.bridge.release",
  "created_at": "2026-08-11T12:05:00Z",
  "scanner": {
    "id": "scanner.trivy",
    "version": "1.2.3",
    "sha256": "aaaaaaaaaaaaaaaaaaaaaaaaaaaaaaaaaaaaaaaaaaaaaaaaaaaaaaaaaaaaaaaa"
  },
  "subject": {
    "sha256": "bbbbbbbbbbbbbbbbbbbbbbbbbbbbbbbbbbbbbbbbbbbbbbbbbbbbbbbbbbbbbbbb",
    "size_bytes": "1024"
  },
  "sbom": {
    "sha256": "cccccccccccccccccccccccccccccccccccccccccccccccccccccccccccccccc",
    "size_bytes": "512"
  },
  "policy": {
    "id": "scan.release",
    "version": "1.0.0",
    "sha256": "dddddddddddddddddddddddddddddddddddddddddddddddddddddddddddddddd"
  },
  "result": "passed",
  "findings": {
    "critical": 0,
    "high": 0,
    "medium": 1,
    "low": 2
  },
  "materials": [
    {
      "sha256": "eeeeeeeeeeeeeeeeeeeeeeeeeeeeeeeeeeeeeeeeeeeeeeeeeeeeeeeeeeeeeeee",
      "size_bytes": "256"
    }
  ]
}
